,CD_IN,VB_DT,_use_,_allow_,_interface_,_cohort_,NN_NNS,CD_IN_DT,MD_VB_DT,SubTrees,VB_CD,MD_VB_NNS,_preferred_,_clinical_,MD_VB_RB,VBG_TO,_recycled_,TO_DT_NN,DT_NNS_VBG,_server_,Adverb,_defensive_,MD_VB,VB_TO,_comply_,_record_,NN_IN_NNS,NN_IN_CD,VB_NN_TO,IN_IN_CD,NN_NN_DT,IN_NN_TO,VBZ_VBN_DT,NNS_IN_JJ,_player_,VB_IN,_90_,Length,MD_VB_IN,_operate_,RB_JJR,IN_NN_IN,_shall_allow_,VB_NN_NNS,_washing_functionality_,Adjective,_facility_,CD_IN_NN,RB_JJ,NNS_MD,JJ_IN,_status_,Modal,_include_,IN_CD_NNS,NNS_IN_CD,Noun,CD_IN_NNS,RB_JJ_NNS,_product_shall_allow_,DT_NN_TO,WRB_DT,NN_CD,RB_TO,_shall_interface_,NNS_CD,_audit_report_,_search_,DT_JJ_MD,Verb,_computer_,TreeHeight,_application_shall_,_software_,CD_NN,VB_DT_NN,_section_,IN_NN,_website_shall_,IN_CD,VBP_VBN,_update_,_prior_,NN_VBG_TO,_sequence_,_using_,_shot_,_hit_,_team_,_navigation_,_meeting_,IN_CD_IN,_preferred_repair_,_game_,CD_CD,VB_NNS,_automatically_,_notify_,IN_NNP,_add_,RequirementText,ProjectID,Class,OnlyQuality,IsFunctional
0,0.0,1.0,0.0,0.0,0.0,0.0,0.0,0.0,1.0,3,0.0,0.0,0.0,0.0,0.0,0.0,0.0,0.0,0.0,0.0,0.0,0.0,1.0,0.0,0.0,0.0,0.0,0.0,0.0,0.0,0.0,0.0,0.0,0.0,0.0,0.0,0.0,109,0.0,0.0,0.0,0.0,0.0,0.0,0.0,0.0625,0.0,0.0,0.0,0.0,0.0,0.0,0.0625,0.0,0.0,0.0,0.125,0.0,0.0,0.0,0.0,0.0,0.0,0.0,0.0,0.0,0.0,0.0,0.0,0.0625,0.0,14,0.0,0.0,0.0,1.0,0.0,0.0,0.0,0.0,0.0,0.0,0.0,0.0,0.0,0.0,0.0,0.0,0.0,0.0,0.0,0.0,0.0,0.0,0.0,1.0,0.0,0.0,0.0,0.0,There should be an application that provides functionality for mobile users to propose and schedule meetings.,1,F,0,0.0
1,0.0,0.0,0.0,0.0,0.0,0.0,0.0,0.0,0.0,3,0.0,1.0,0.0,0.0,0.0,0.0,0.0,0.0,0.0,0.0,0.0,0.0,1.0,0.0,0.0,0.0,0.0,0.0,0.0,0.0,0.0,1.0,0.0,0.0,0.0,0.0,0.0,167,0.0,0.0,0.0,0.0,0.0,0.0,0.0,0.03333333333333333,0.0,0.0,0.0,0.0,0.0,0.0,0.06666666666666667,0.0,0.0,0.0,0.06666666666666667,0.0,0.0,0.0,0.0,0.0,0.0,0.0,0.0,0.0,0.0,0.0,0.0,0.06666666666666667,0.0,21,0.0,0.0,0.0,0.0,0.0,1.0,0.0,0.0,0.0,0.0,0.0,0.0,0.0,0.0,0.0,0.0,0.0,0.0,0.0,0.0,0.0,0.0,0.0,1.0,0.0,0.0,1.0,0.0,The WASP platform must provide services that may be used by WASP applications in order to personalize content for a specific end-user based on his or her user profile.,1,F,0,0.0
2,0.0,0.0,0.0,0.0,0.0,0.0,1.0,0.0,0.0,3,0.0,1.0,0.0,0.0,0.0,0.0,0.0,0.0,0.0,0.0,0.0,0.0,1.0,0.0,0.0,0.0,0.0,0.0,0.0,0.0,0.0,1.0,0.0,0.0,0.0,0.0,0.0,166,0.0,0.0,0.0,0.0,0.0,0.0,0.0,0.0,0.0,0.0,0.0,0.0,0.0,0.0,0.06896551724137931,0.0,0.0,0.0,0.13793103448275862,0.0,0.0,0.0,0.0,0.0,0.0,0.0,0.0,0.0,0.0,0.0,0.0,0.06896551724137931,0.0,20,0.0,0.0,0.0,0.0,0.0,1.0,0.0,0.0,0.0,0.0,0.0,0.0,0.0,0.0,0.0,0.0,0.0,0.0,0.0,0.0,0.0,0.0,0.0,1.0,0.0,0.0,1.0,0.0,The WASP platform should provide services that may be used by WASP applications in order to personalize content for a group of end-users based on their user profiles.,1,F,0,0.0
3,1.0,1.0,0.0,0.0,0.0,0.0,0.0,0.0,0.0,3,0.0,1.0,0.0,0.0,0.0,0.0,0.0,0.0,0.0,0.0,0.0,0.0,1.0,0.0,0.0,0.0,0.0,0.0,0.0,0.0,0.0,0.0,0.0,0.0,0.0,0.0,0.0,128,0.0,0.0,0.0,0.0,0.0,0.0,0.0,0.0,0.0,0.0,0.0,0.0,0.0,0.0,0.08333333333333333,0.0,0.0,0.0,0.08333333333333333,0.0,0.0,0.0,0.0,0.0,0.0,0.0,0.0,0.0,0.0,0.0,0.0,0.041666666666666664,0.0,20,0.0,0.0,0.0,1.0,0.0,0.0,0.0,0.0,0.0,0.0,0.0,0.0,0.0,1.0,0.0,0.0,0.0,0.0,0.0,0.0,0.0,0.0,0.0,1.0,0.0,0.0,0.0,0.0,The WASP platform must provide services that may be used by a WASP application to charge the user for using one of his services.,1,F,0,0.0
4,0.0,0.0,0.0,1.0,0.0,0.0,1.0,0.0,0.0,3,0.0,0.0,0.0,0.0,0.0,0.0,0.0,0.0,0.0,0.0,0.05263157894736842,0.0,1.0,0.0,0.0,0.0,0.0,0.0,0.0,0.0,0.0,0.0,0.0,0.0,0.0,0.0,0.0,125,0.0,0.0,0.0,0.0,0.0,1.0,0.0,0.05263157894736842,0.0,0.0,0.0,0.0,0.0,0.0,0.05263157894736842,0.0,0.0,0.0,0.10526315789473684,0.0,0.0,0.0,0.0,0.0,0.0,1.0,0.0,0.0,0.0,0.0,0.0,0.10526315789473684,0.0,11,0.0,0.0,0.0,0.0,0.0,0.0,0.0,0.0,0.0,0.0,0.0,0.0,0.0,0.0,0.0,0.0,0.0,0.0,0.0,0.0,0.0,0.0,0.0,0.0,0.0,0.0,0.0,0.0,The WASP platform must allow end-users to provide profile and context information explicitly to applications or the platform.,1,F,0,0.0
5,0.0,0.0,0.0,0.0,0.0,0.0,0.0,0.0,0.0,3,0.0,0.0,0.0,0.0,0.0,0.0,0.0,0.0,0.0,0.0,0.0,0.0,1.0,0.0,0.0,0.0,0.0,0.0,0.0,0.0,0.0,0.0,0.0,0.0,0.0,1.0,0.0,78,1.0,0.0,0.0,0.0,0.0,0.0,0.0,0.06666666666666667,0.0,0.0,0.0,0.0,0.0,0.0,0.06666666666666667,0.0,0.0,0.0,0.3333333333333333,0.0,0.0,0.0,0.0,0.0,0.0,0.0,0.0,0.0,0.0,0.0,0.0,0.06666666666666667,0.0,8,0.0,0.0,0.0,0.0,0.0,0.0,0.0,0.0,0.0,0.0,0.0,0.0,0.0,0.0,0.0,0.0,0.0,0.0,0.0,0.0,0.0,0.0,0.0,0.0,0.0,0.0,0.0,0.0,A user's profile must contain at least one charging point for a specific user.,1,F,0,0.0
6,0.0,0.0,0.0,0.0,0.0,0.0,0.0,0.0,0.0,3,0.0,0.0,0.0,0.0,0.0,0.0,0.0,0.0,0.0,0.0,0.0,0.0,1.0,0.0,0.0,0.0,0.0,0.0,0.0,0.0,0.0,0.0,0.0,0.0,0.0,0.0,0.0,82,0.0,0.0,0.0,0.0,0.0,0.0,0.0,0.0,0.0,0.0,0.0,0.0,0.0,0.0,0.07142857142857142,0.0,0.0,0.0,0.2857142857142857,0.0,0.0,0.0,0.0,0.0,0.0,0.0,0.0,0.0,0.0,0.0,0.0,0.07142857142857142,0.0,10,0.0,0.0,0.0,0.0,0.0,0.0,0.0,0.0,0.0,0.0,0.0,0.0,0.0,0.0,0.0,0.0,0.0,0.0,0.0,0.0,0.0,0.0,0.0,0.0,0.0,0.0,0.0,0.0,A WASP application must be authorized by the end-user before charging his account.,1,F,1,0.0
7,0.0,1.0,0.0,0.0,0.0,0.0,0.0,0.0,0.0,3,0.0,0.0,0.0,0.0,0.0,0.0,0.0,0.0,1.0,0.0,0.0,0.0,1.0,0.0,0.0,0.0,0.0,0.0,1.0,0.0,0.0,0.0,0.0,0.0,0.0,0.0,0.0,189,0.0,0.0,0.0,0.0,0.0,0.0,0.0,0.03225806451612903,0.0,0.0,0.0,0.0,0.0,0.0,0.03225806451612903,0.0,0.0,0.0,0.06451612903225806,0.0,0.0,0.0,0.0,0.0,0.0,0.0,0.0,0.0,0.0,0.0,0.0,0.03225806451612903,0.0,19,0.0,0.0,0.0,0.0,0.0,1.0,0.0,0.0,0.0,0.0,0.0,0.0,0.0,0.0,0.0,0.0,0.0,0.0,0.0,0.0,0.0,0.0,0.0,1.0,0.0,0.0,0.0,0.0,The WASP platform shall provide functionality to find points of interest that match the user's explicit need and obey the restrictions following from the user's profile and current context.,1,F,0,0.0
8,0.0,0.0,0.0,1.0,0.0,0.0,1.0,0.0,0.0,3,0.0,0.0,0.0,0.0,0.0,0.0,0.0,0.0,0.0,0.0,0.037037037037037035,0.0,1.0,0.0,0.0,0.0,1.0,0.0,0.0,0.0,0.0,0.0,0.0,0.0,0.0,0.0,0.0,152,0.0,0.0,0.0,1.0,0.0,1.0,0.0,0.037037037037037035,0.0,0.0,0.0,0.0,0.0,0.0,0.037037037037037035,0.0,0.0,0.0,0.1111111111111111,0.0,0.0,0.0,0.0,0.0,0.0,0.0,0.0,0.0,0.0,0.0,0.0,0.07407407407407407,0.0,18,0.0,0.0,0.0,0.0,0.0,1.0,0.0,0.0,0.0,0.0,0.0,0.0,0.0,0.0,0.0,0.0,0.0,0.0,0.0,0.0,0.0,0.0,0.0,1.0,1.0,0.0,0.0,0.0,"The WASP platform must allow end-users to place triggers to be alerted automatically for a certain type of point of interests, based on his/her context.",1,F,0,0.0
9,0.0,0.0,0.0,1.0,0.0,0.0,1.0,0.0,0.0,3,0.0,0.0,0.0,0.0,0.0,0.0,0.0,0.0,0.0,0.0,0.03333333333333333,0.0,1.0,0.0,0.0,0.0,1.0,0.0,0.0,0.0,0.0,0.0,0.0,0.0,0.0,0.0,0.0,169,0.0,0.0,0.0,0.0,0.0,1.0,0.0,0.03333333333333333,0.0,0.0,0.0,0.0,0.0,0.0,0.03333333333333333,0.0,0.0,0.0,0.13333333333333333,0.0,0.0,0.0,1.0,0.0,0.0,0.0,0.0,0.0,0.0,0.0,0.0,0.06666666666666667,0.0,17,0.0,0.0,0.0,0.0,0.0,0.0,0.0,0.0,0.0,0.0,0.0,0.0,0.0,0.0,0.0,0.0,0.0,0.0,0.0,0.0,0.0,0.0,0.0,1.0,1.0,0.0,0.0,0.0,"The WASP platform must allow end-users to place triggers in the platform to be alerted automatically for a certain type of services and events, based on his/her context.",1,F,0,0.0
10,0.0,0.0,0.0,0.0,0.0,0.0,0.0,0.0,0.0,3,0.0,0.0,0.0,0.0,0.0,0.0,0.0,0.0,0.0,0.0,0.0,0.0,1.0,0.0,0.0,0.0,0.0,0.0,1.0,0.0,0.0,0.0,0.0,0.0,0.0,1.0,0.0,100,0.0,0.0,0.0,0.0,0.0,0.0,0.0,0.06666666666666667,0.0,0.0,0.0,0.0,0.0,0.0,0.06666666666666667,0.0,0.0,0.0,0.06666666666666667,0.0,0.0,0.0,0.0,0.0,0.0,0.0,0.0,0.0,0.0,1.0,0.0,0.06666666666666667,0.0,13,0.0,0.0,0.0,0.0,0.0,0.0,0.0,0.0,0.0,0.0,0.0,0.0,0.0,0.0,0.0,0.0,0.0,0.0,0.0,0.0,0.0,0.0,0.0,0.0,0.0,0.0,0.0,0.0,The WASP platform shall provide functionality to search for other people registered in the platform.,1,F,0,0.0
11,0.0,1.0,0.0,0.0,0.0,0.0,1.0,0.0,0.0,4,0.0,1.0,0.0,0.0,0.0,0.0,0.0,1.0,1.0,0.0,0.0,0.0,1.0,0.0,0.0,0.0,0.0,0.0,1.0,0.0,0.0,0.0,0.0,0.0,0.0,0.0,0.0,267,0.0,0.0,0.0,0.0,0.0,0.0,0.0,0.023255813953488372,0.0,0.0,0.0,0.0,0.0,0.0,0.046511627906976744,0.0,0.0,0.0,0.11627906976744186,0.0,0.0,0.0,0.0,0.0,0.0,0.0,0.0,0.0,0.0,0.0,0.0,0.023255813953488372,0.0,22,0.0,0.0,0.0,0.0,0.0,0.0,0.0,0.0,0.0,0.0,0.0,0.0,0.0,0.0,0.0,0.0,0.0,0.0,0.0,0.0,0.0,0.0,0.0,1.0,0.0,0.0,0.0,0.0,The WASP platform shall provide functionality to find services that match the user's explicit need and obey the restrictions following from the user's profile and current context. For the found services the WASP platform shall provide (links to) the service profiles.,1,F,0,0.0
12,0.0,1.0,0.0,1.0,0.0,0.0,1.0,0.0,0.0,3,0.0,0.0,0.0,0.0,0.0,0.0,0.0,0.0,0.0,0.0,0.0,0.0,1.0,0.0,0.0,0.0,0.0,0.0,0.0,0.0,0.0,0.0,0.0,0.0,0.0,0.0,0.0,65,0.0,0.0,0.0,0.0,1.0,1.0,0.0,0.08333333333333333,0.0,0.0,0.0,0.0,0.0,0.0,0.08333333333333333,0.0,0.0,0.0,0.08333333333333333,0.0,0.0,0.0,0.0,0.0,0.0,0.0,0.0,0.0,0.0,0.0,0.0,0.16666666666666666,0.0,9,0.0,0.0,0.0,0.0,0.0,0.0,0.0,0.0,0.0,0.0,0.0,0.0,0.0,0.0,0.0,0.0,0.0,0.0,0.0,0.0,0.0,0.0,0.0,0.0,0.0,0.0,0.0,0.0,The WASP platform shall allow end-users to maintain a buddy list.,1,F,0,0.0
13,0.0,0.0,0.0,0.0,0.0,0.0,1.0,0.0,0.0,3,0.0,0.0,0.0,0.0,0.0,0.0,0.0,0.0,0.0,0.0,0.0,0.0,1.0,0.0,0.0,0.0,0.0,0.0,0.0,0.0,0.0,0.0,0.0,0.0,0.0,1.0,0.0,94,0.0,0.0,0.0,0.0,0.0,0.0,0.0,0.0,0.0,0.0,0.0,0.0,0.0,0.0,0.07142857142857142,0.0,0.0,0.0,0.14285714285714285,0.0,0.0,0.0,0.0,0.0,0.0,0.0,0.0,0.0,0.0,0.0,0.0,0.14285714285714285,0.0,11,0.0,0.0,0.0,0.0,0.0,1.0,0.0,0.0,0.0,0.0,0.0,0.0,0.0,0.0,0.0,0.0,0.0,0.0,0.0,0.0,0.0,0.0,0.0,0.0,0.0,0.0,0.0,0.0,The WASP platform shall provide functionality for end-users to communicate with their buddies.,1,F,0,0.0
14,0.0,0.0,1.0,0.0,0.0,0.0,1.0,0.0,0.0,3,0.0,0.0,0.0,0.0,0.0,0.0,0.0,0.0,0.0,0.0,0.0,0.0,1.0,0.0,0.0,0.0,0.0,0.0,0.0,0.0,0.0,0.0,0.0,0.0,0.0,0.0,0.0,98,0.0,0.0,0.0,0.0,0.0,0.0,0.0,0.125,0.0,0.0,0.0,0.0,0.0,0.0,0.0625,0.0,0.0,0.0,0.0625,0.0,0.0,0.0,0.0,0.0,0.0,0.0,0.0,0.0,0.0,0.0,0.0,0.0625,0.0,13,0.0,0.0,1.0,0.0,0.0,0.0,0.0,0.0,0.0,0.0,0.0,0.0,0.0,0.0,0.0,0.0,0.0,0.0,0.0,0.0,0.0,0.0,0.0,0.0,0.0,0.0,0.0,0.0,The WASP platform should be able to use several communication services offered by the 3G platform.,1,F,1,0.0
15,0.0,0.0,0.0,0.0,0.0,0.0,0.0,0.0,0.0,3,0.0,0.0,0.0,0.0,0.0,0.0,0.0,0.0,0.0,0.0,0.02631578947368421,0.0,1.0,0.0,0.0,0.0,1.0,0.0,0.0,0.0,0.0,0.0,0.0,0.0,0.0,0.0,0.0,208,0.0,0.0,0.0,1.0,0.0,0.0,0.0,0.05263157894736842,0.0,0.0,0.0,0.0,0.0,1.0,0.02631578947368421,0.0,0.0,0.0,0.02631578947368421,0.0,0.0,0.0,0.0,0.0,0.0,0.0,0.0,0.0,0.0,0.0,0.0,0.02631578947368421,0.0,15,0.0,0.0,0.0,0.0,0.0,1.0,0.0,0.0,0.0,1.0,0.0,0.0,0.0,0.0,0.0,0.0,0.0,0.0,0.0,0.0,0.0,0.0,0.0,0.0,0.0,0.0,0.0,0.0,"The WASP platform shall be able to update status and location information of buddies in the user's buddy list based either on request of the user, after login into the WASP platform and at a regular interval.",1,F,0,0.0
16,0.0,0.0,0.0,1.0,0.0,0.0,1.0,0.0,0.0,3,0.0,0.0,0.0,0.0,0.0,0.0,0.0,0.0,0.0,0.0,0.0,0.0,1.0,0.0,0.0,0.0,1.0,0.0,0.0,0.0,0.0,0.0,0.0,0.0,0.0,0.0,0.0,125,0.0,0.0,0.0,0.0,0.0,1.0,0.0,0.0,0.0,0.0,0.0,0.0,0.0,1.0,0.041666666666666664,0.0,0.0,0.0,0.16666666666666666,0.0,0.0,0.0,0.0,0.0,0.0,0.0,0.0,0.0,0.0,0.0,0.0,0.08333333333333333,0.0,14,0.0,0.0,0.0,0.0,0.0,0.0,0.0,0.0,0.0,0.0,0.0,0.0,0.0,0.0,0.0,0.0,0.0,0.0,0.0,0.0,0.0,0.0,0.0,1.0,0.0,0.0,0.0,0.0,The WASP platform must allow end-users to set alerts in the platform on changes in the status and/or location of his buddies.,1,F,0,0.0
17,0.0,0.0,0.0,0.0,0.0,0.0,0.0,0.0,0.0,4,0.0,0.0,0.0,0.0,0.0,1.0,0.0,0.0,0.0,0.0,0.0,0.0,1.0,0.0,0.0,0.0,0.0,0.0,0.0,0.0,0.0,0.0,0.0,0.0,0.0,0.0,0.0,162,0.0,0.0,0.0,0.0,0.0,0.0,0.0,0.0,0.0,0.0,0.0,0.0,0.0,1.0,0.03333333333333333,0.0,0.0,0.0,0.03333333333333333,0.0,0.0,0.0,0.0,0.0,0.0,0.0,0.0,0.0,0.0,0.0,0.0,0.03333333333333333,0.0,12,0.0,0.0,0.0,0.0,0.0,0.0,0.0,0.0,1.0,0.0,0.0,0.0,0.0,0.0,0.0,0.0,0.0,0.0,0.0,0.0,0.0,0.0,0.0,0.0,0.0,0.0,0.0,0.0,"When changes are discovered in the status and/or location of a user's buddy, the WASP platform must sent out notifications according to the alerts set by the user",1,F,0,0.0
18,0.0,1.0,0.0,0.0,0.0,0.0,0.0,0.0,0.0,3,0.0,0.0,0.0,0.0,0.0,0.0,0.0,0.0,0.0,0.0,0.0,0.0,1.0,0.0,0.0,0.0,0.0,0.0,0.0,0.0,0.0,0.0,0.0,0.0,0.0,0.0,0.0,110,0.0,0.0,0.0,0.0,0.0,0.0,0.0,0.05,0.0,0.0,0.0,0.0,0.0,0.0,0.05,0.0,0.0,0.0,0.25,0.0,0.0,0.0,0.0,0.0,0.0,0.0,0.0,0.0,0.0,0.0,0.0,0.05,0.0,13,1.0,0.0,0.0,1.0,0.0,0.0,0.0,0.0,0.0,0.0,0.0,0.0,0.0,1.0,0.0,0.0,0.0,0.0,0.0,0.0,0.0,0.0,0.0,0.0,0.0,0.0,0.0,0.0,A WASP application shall be able to setup a phone call connection using the 3G Platform via the WASP platform.,1,F,0,0.0
19,0.0,0.0,0.0,1.0,0.0,0.0,0.0,0.0,0.0,3,0.0,0.0,0.0,0.0,0.0,0.0,0.0,0.0,0.0,0.0,0.0,0.0,1.0,0.0,0.0,0.0,0.0,0.0,0.0,0.0,0.0,0.0,0.0,0.0,0.0,0.0,0.0,161,0.0,0.0,0.0,0.0,1.0,0.0,0.0,0.03571428571428571,0.0,0.0,0.0,0.0,0.0,1.0,0.03571428571428571,0.0,0.0,0.0,0.2857142857142857,0.0,0.0,0.0,0.0,0.0,0.0,0.0,0.0,0.0,0.0,0.0,0.0,0.03571428571428571,0.0,13,0.0,0.0,0.0,0.0,0.0,0.0,0.0,0.0,0.0,0.0,0.0,0.0,0.0,0.0,0.0,0.0,0.0,0.0,0.0,0.0,0.0,0.0,0.0,0.0,0.0,0.0,0.0,0.0,"The WASP platform shall allow status information to be stored, updated, retrieved and deleted in the user's profile in the WASP platform if the user allows this.",1,F,0,0.0
20,0.0,0.0,0.0,1.0,0.0,0.0,1.0,0.0,0.0,3,0.0,0.0,0.0,0.0,0.0,0.0,0.0,0.0,0.0,0.0,0.0,0.0,1.0,0.0,0.0,0.0,0.0,0.0,0.0,0.0,0.0,0.0,0.0,0.0,0.0,0.0,0.0,201,0.0,0.0,0.0,0.0,1.0,1.0,0.0,0.058823529411764705,0.0,0.0,0.0,0.0,0.0,0.0,0.029411764705882353,0.0,0.0,0.0,0.14705882352941177,0.0,0.0,0.0,0.0,0.0,0.0,0.0,0.0,0.0,0.0,0.0,0.0,0.08823529411764706,0.0,12,0.0,0.0,1.0,0.0,0.0,0.0,0.0,0.0,0.0,0.0,0.0,0.0,0.0,0.0,0.0,0.0,0.0,0.0,0.0,0.0,0.0,0.0,0.0,0.0,0.0,0.0,0.0,0.0,"The WASP platform shall allow end-users to give and remove Create, Read, Update, Delete (CRUD) access rights on parts of the user profile to other users, specific WASP applications and the 3G Platform.",1,F,0,0.0
21,0.0,1.0,0.0,1.0,0.0,0.0,1.0,0.0,0.0,3,0.0,0.0,0.0,0.0,0.0,0.0,0.0,0.0,0.0,0.0,0.0,0.0,1.0,0.0,0.0,0.0,0.0,0.0,0.0,0.0,0.0,0.0,0.0,0.0,0.0,0.0,0.0,152,0.0,0.0,0.0,0.0,1.0,0.0,0.0,0.03571428571428571,0.0,0.0,0.0,0.0,0.0,0.0,0.03571428571428571,0.0,0.0,0.0,0.14285714285714285,0.0,0.0,0.0,0.0,0.0,0.0,0.0,0.0,0.0,0.0,0.0,0.0,0.07142857142857142,0.0,14,0.0,0.0,0.0,1.0,0.0,1.0,0.0,0.0,0.0,0.0,0.0,0.0,0.0,0.0,0.0,0.0,0.0,0.0,0.0,0.0,0.0,0.0,0.0,0.0,0.0,0.0,0.0,0.0,"The WASP platform shall allow other users, WASP applications and/or the 3G Platform to ask the end- user for access rights on parts of the user profile.",1,F,0,0.0
22,0.0,0.0,0.0,0.0,0.0,0.0,0.0,0.0,0.0,3,0.0,0.0,0.0,0.0,0.0,0.0,0.0,0.0,0.0,0.0,0.0,0.0,1.0,0.0,0.0,0.0,0.0,0.0,0.0,0.0,0.0,0.0,0.0,0.0,0.0,0.0,0.0,108,0.0,0.0,0.0,0.0,0.0,0.0,0.0,0.16666666666666666,0.0,0.0,0.0,0.0,0.0,0.0,0.05555555555555555,0.0,0.0,0.0,0.05555555555555555,0.0,0.0,0.0,0.0,0.0,0.0,0.0,0.0,0.0,0.0,0.0,0.0,0.1111111111111111,0.0,12,0.0,0.0,0.0,0.0,0.0,0.0,0.0,0.0,0.0,0.0,0.0,0.0,0.0,0.0,0.0,0.0,0.0,0.0,0.0,0.0,0.0,0.0,0.0,0.0,0.0,0.0,0.0,0.0,The WASP platform must be able to collect profile and context information on the user from multiple sources.,1,F,0,0.0
23,0.0,1.0,0.0,1.0,0.0,0.0,1.0,0.0,0.0,3,0.0,0.0,0.0,0.0,0.0,0.0,0.0,0.0,0.0,0.0,0.0,0.0,1.0,0.0,0.0,0.0,0.0,0.0,1.0,0.0,0.0,0.0,0.0,0.0,0.0,0.0,0.0,134,0.0,0.0,0.0,0.0,0.0,1.0,0.0,0.04,0.0,0.0,0.0,0.0,0.0,0.0,0.04,0.0,0.0,0.0,0.16,0.0,0.0,0.0,0.0,0.0,0.0,0.0,0.0,0.0,0.0,0.0,0.0,0.16,0.0,17,0.0,0.0,0.0,0.0,0.0,0.0,0.0,0.0,0.0,0.0,0.0,0.0,0.0,0.0,0.0,0.0,0.0,0.0,0.0,0.0,0.0,0.0,0.0,0.0,0.0,0.0,0.0,0.0,The WASP platform should allow end-users to delegate and remove the rights to give access to parts of the user profile to other users.,1,F,0,0.0
24,0.0,1.0,0.0,0.0,0.0,0.0,0.0,0.0,0.0,3,0.0,0.0,0.0,0.0,0.0,0.0,0.0,0.0,0.0,0.0,0.0,0.0,1.0,0.0,0.0,0.0,0.0,0.0,1.0,0.0,0.0,0.0,0.0,0.0,0.0,0.0,0.0,91,0.0,0.0,0.0,0.0,0.0,0.0,0.0,0.07142857142857142,0.0,0.0,0.0,0.0,0.0,0.0,0.07142857142857142,0.0,0.0,0.0,0.2857142857142857,0.0,0.0,0.0,0.0,0.0,0.0,0.0,0.0,0.0,0.0,0.0,0.0,0.14285714285714285,0.0,13,0.0,0.0,0.0,0.0,0.0,0.0,0.0,0.0,0.0,0.0,0.0,0.0,0.0,0.0,0.0,0.0,0.0,0.0,0.0,0.0,0.0,0.0,0.0,0.0,0.0,0.0,0.0,0.0,The WASP platform shall provide functionality to retrieve the current location of the user.,1,F,0,0.0
25,0.0,0.0,0.0,0.0,0.0,0.0,0.0,0.0,0.0,3,0.0,0.0,0.0,0.0,0.0,0.0,0.0,0.0,0.0,0.0,0.0,0.0,1.0,0.0,0.0,0.0,0.0,0.0,0.0,0.0,0.0,0.0,0.0,0.0,0.0,0.0,0.0,83,0.0,0.0,0.0,0.0,0.0,0.0,0.0,0.07142857142857142,0.0,0.0,0.0,0.0,0.0,1.0,0.07142857142857142,0.0,0.0,0.0,0.2857142857142857,0.0,0.0,0.0,0.0,0.0,0.0,0.0,0.0,0.0,0.0,0.0,0.0,0.14285714285714285,0.0,11,0.0,0.0,1.0,0.0,0.0,0.0,0.0,0.0,0.0,0.0,0.0,0.0,0.0,0.0,0.0,0.0,0.0,0.0,0.0,0.0,0.0,0.0,0.0,0.0,0.0,0.0,0.0,0.0,The WASP platform must be able to retrieve status information from the 3G Platform.,1,F,0,0.0
26,0.0,0.0,0.0,0.0,0.0,0.0,0.0,0.0,0.0,3,0.0,0.0,0.0,0.0,0.0,0.0,0.0,0.0,0.0,0.0,0.0,0.0,1.0,0.0,0.0,0.0,0.0,0.0,0.0,0.0,0.0,0.0,0.0,0.0,0.0,0.0,0.0,85,0.0,0.0,0.0,0.0,0.0,0.0,0.0,0.07142857142857142,0.0,0.0,0.0,0.0,0.0,0.0,0.07142857142857142,0.0,0.0,0.0,0.2857142857142857,0.0,0.0,0.0,0.0,0.0,0.0,0.0,0.0,0.0,0.0,0.0,0.0,0.14285714285714285,0.0,11,0.0,0.0,1.0,0.0,0.0,0.0,0.0,0.0,0.0,0.0,0.0,0.0,0.0,0.0,0.0,0.0,0.0,0.0,0.0,0.0,0.0,0.0,0.0,0.0,0.0,0.0,0.0,0.0,The WASP platform must be able to retrieve location information from the 3G Platform.,1,F,0,0.0
27,0.0,0.0,0.0,0.0,0.0,0.0,0.0,0.0,0.0,3,0.0,0.0,0.0,0.0,0.0,0.0,0.0,0.0,0.0,0.0,0.0,0.0,1.0,0.0,0.0,0.0,0.0,0.0,0.0,0.0,0.0,0.0,0.0,0.0,0.0,0.0,0.0,97,0.0,0.0,0.0,0.0,0.0,0.0,0.0,0.05555555555555555,0.0,0.0,0.0,0.0,1.0,0.0,0.05555555555555555,0.0,0.0,0.0,0.1111111111111111,0.0,0.0,0.0,0.0,0.0,0.0,0.0,0.0,0.0,0.0,0.0,0.0,0.05555555555555555,0.0,13,0.0,0.0,0.0,0.0,0.0,0.0,0.0,0.0,0.0,0.0,0.0,0.0,0.0,1.0,0.0,0.0,0.0,0.0,0.0,0.0,0.0,0.0,0.0,0.0,0.0,0.0,0.0,0.0,It must be possible for a WASP application to send out messages to users using the WASP platform.,1,F,0,0.0
28,0.0,1.0,0.0,0.0,0.0,0.0,1.0,0.0,1.0,3,0.0,0.0,0.0,0.0,0.0,0.0,0.0,1.0,0.0,0.0,0.03225806451612903,0.0,1.0,0.0,0.0,0.0,0.0,0.0,0.0,0.0,0.0,1.0,0.0,0.0,0.0,0.0,0.0,196,0.0,0.0,0.0,0.0,0.0,0.0,0.0,0.06451612903225806,0.0,0.0,0.0,0.0,0.0,0.0,0.06451612903225806,0.0,0.0,0.0,0.03225806451612903,0.0,0.0,0.0,0.0,0.0,0.0,0.0,0.0,0.0,0.0,0.0,0.0,0.0967741935483871,0.0,16,0.0,0.0,0.0,0.0,0.0,1.0,0.0,0.0,0.0,0.0,0.0,0.0,0.0,0.0,0.0,0.0,0.0,0.0,0.0,0.0,0.0,0.0,0.0,0.0,1.0,0.0,0.0,0.0,"A WASP application should be able to automatically adapt content and the presentation of functionality to the user's device, for which the WASP platform may offer some generic adaptation services.",1,F,0,0.0
29,0.0,0.0,0.0,0.0,0.0,0.0,0.0,0.0,0.0,3,0.0,0.0,0.0,0.0,0.0,0.0,0.0,0.0,0.0,0.0,0.0,0.0,1.0,0.0,0.0,0.0,1.0,0.0,0.0,0.0,0.0,0.0,0.0,0.0,0.0,0.0,0.0,184,0.0,0.0,0.0,0.0,0.0,0.0,0.0,0.0625,0.0,0.0,0.0,0.0,0.0,0.0,0.03125,0.0,0.0,0.0,0.03125,0.0,0.0,0.0,0.0,0.0,0.0,0.0,0.0,0.0,0.0,1.0,0.0,0.0625,0.0,16,0.0,0.0,0.0,0.0,0.0,1.0,0.0,0.0,0.0,0.0,0.0,0.0,0.0,0.0,0.0,0.0,0.0,0.0,0.0,0.0,0.0,0.0,0.0,0.0,0.0,0.0,0.0,0.0,The WASP platform must be able to combine knowledge about the end-user (in terms of profile and context) and a specific information request into a search query on the service registry.,1,F,0,0.0
30,0.0,1.0,0.0,0.0,0.0,0.0,0.0,0.0,0.0,3,0.0,0.0,0.0,0.0,0.0,0.0,0.0,0.0,0.0,0.0,0.0,0.0,1.0,0.0,0.0,0.0,0.0,0.0,0.0,0.0,0.0,0.0,0.0,0.0,0.0,0.0,0.0,61,0.0,0.0,0.0,0.0,0.0,0.0,0.0,0.07142857142857142,0.0,0.0,0.0,0.0,0.0,0.0,0.07142857142857142,0.0,0.0,0.0,0.21428571428571427,0.0,0.0,0.0,0.0,0.0,0.0,0.0,0.0,0.0,0.0,0.0,0.0,0.07142857142857142,0.0,12,0.0,0.0,0.0,1.0,0.0,0.0,0.0,0.0,0.0,0.0,0.0,0.0,0.0,0.0,0.0,0.0,0.0,0.0,0.0,0.0,0.0,0.0,0.0,0.0,0.0,0.0,0.0,0.0,The WASP platform must be able to draw a map of a given area.,1,F,0,0.0
31,0.0,1.0,0.0,0.0,0.0,0.0,0.0,0.0,0.0,3,0.0,0.0,0.0,0.0,0.0,0.0,0.0,0.0,0.0,0.0,0.0,0.0,1.0,0.0,0.0,0.0,1.0,0.0,0.0,0.0,0.0,0.0,0.0,0.0,0.0,0.0,0.0,70,0.0,0.0,0.0,0.0,0.0,0.0,0.0,0.06666666666666667,0.0,0.0,0.0,0.0,0.0,0.0,0.06666666666666667,0.0,0.0,0.0,0.06666666666666667,0.0,0.0,0.0,0.0,0.0,0.0,0.0,0.0,0.0,0.0,0.0,0.0,0.13333333333333333,0.0,12,0.0,0.0,0.0,1.0,0.0,0.0,0.0,0.0,0.0,0.0,0.0,0.0,0.0,0.0,0.0,0.0,0.0,0.0,0.0,0.0,0.0,0.0,0.0,0.0,0.0,0.0,0.0,0.0,The WASP platform must be able to show the location of users on a map.,1,F,0,0.0
32,0.0,1.0,0.0,0.0,0.0,0.0,0.0,0.0,0.0,3,0.0,0.0,0.0,0.0,0.0,0.0,0.0,0.0,0.0,0.0,0.0,0.0,1.0,0.0,0.0,0.0,0.0,0.0,0.0,0.0,0.0,0.0,0.0,0.0,0.0,0.0,0.0,92,0.0,0.0,0.0,0.0,0.0,0.0,0.0,0.1111111111111111,0.0,0.0,0.0,0.0,0.0,0.0,0.05555555555555555,0.0,0.0,0.0,0.1111111111111111,0.0,0.0,0.0,0.0,0.0,0.0,0.0,0.0,0.0,0.0,0.0,0.0,0.1111111111111111,0.0,15,0.0,0.0,0.0,1.0,0.0,0.0,0.0,0.0,0.0,0.0,0.0,0.0,0.0,0.0,0.0,0.0,0.0,0.0,0.0,0.0,0.0,0.0,0.0,0.0,0.0,0.0,0.0,0.0,The WASP platform must be able to show the location of various points of interests on a map.,1,F,0,0.0
33,0.0,1.0,0.0,0.0,0.0,0.0,0.0,0.0,0.0,3,0.0,0.0,0.0,0.0,0.0,0.0,0.0,0.0,0.0,0.0,0.0,0.0,1.0,0.0,0.0,0.0,1.0,0.0,0.0,0.0,0.0,0.0,0.0,0.0,0.0,0.0,0.0,89,0.0,0.0,0.0,0.0,0.0,0.0,0.0,0.13333333333333333,0.0,0.0,0.0,0.0,0.0,0.0,0.06666666666666667,0.0,0.0,0.0,0.13333333333333333,0.0,0.0,0.0,0.0,0.0,0.0,0.0,0.0,0.0,0.0,0.0,0.0,0.13333333333333333,0.0,14,0.0,0.0,0.0,0.0,0.0,0.0,0.0,0.0,0.0,0.0,0.0,0.0,0.0,0.0,0.0,0.0,0.0,0.0,0.0,0.0,0.0,0.0,0.0,0.0,0.0,0.0,0.0,0.0,The WASP platform shall be able to obtain the geographic location of points of interests.,1,F,0,0.0
34,0.0,1.0,0.0,0.0,0.0,0.0,0.0,0.0,0.0,3,0.0,0.0,0.0,0.0,0.0,0.0,0.0,0.0,0.0,0.0,0.0,0.0,1.0,0.0,0.0,0.0,0.0,0.0,0.0,0.0,0.0,0.0,0.0,0.0,0.0,0.0,0.0,89,0.0,0.0,0.0,0.0,0.0,0.0,0.0,0.05555555555555555,0.0,0.0,0.0,0.0,0.0,0.0,0.05555555555555555,0.0,0.0,0.0,0.05555555555555555,0.0,0.0,0.0,0.0,0.0,0.0,0.0,0.0,0.0,0.0,0.0,0.0,0.05555555555555555,0.0,14,0.0,0.0,0.0,1.0,0.0,0.0,0.0,0.0,0.0,0.0,0.0,0.0,0.0,0.0,0.0,0.0,0.0,0.0,0.0,0.0,0.0,0.0,0.0,0.0,0.0,0.0,0.0,0.0,The WASP platform must be able to display a route connecting two or more points on a map.,1,F,0,0.0
35,0.0,1.0,0.0,0.0,0.0,0.0,1.0,0.0,0.0,3,0.0,0.0,0.0,0.0,0.0,0.0,0.0,0.0,0.0,0.0,0.0,0.0,1.0,0.0,0.0,0.0,0.0,0.0,0.0,0.0,0.0,0.0,0.0,0.0,0.0,0.0,0.0,94,0.0,0.0,0.0,0.0,0.0,0.0,0.0,0.0625,0.0,0.0,0.0,0.0,0.0,0.0,0.0625,0.0,0.0,0.0,0.0625,0.0,0.0,0.0,0.0,0.0,0.0,0.0,0.0,0.0,0.0,0.0,0.0,0.125,0.0,11,0.0,0.0,0.0,1.0,0.0,1.0,0.0,0.0,0.0,0.0,0.0,0.0,0.0,0.0,0.0,0.0,0.0,0.0,0.0,0.0,0.0,0.0,0.0,0.0,0.0,0.0,0.0,0.0,The WASP platform should be able to provide the end-user with walking or driving instructions.,1,F,0,0.0
36,0.0,1.0,0.0,0.0,0.0,0.0,0.0,0.0,0.0,3,0.0,0.0,0.0,0.0,0.0,0.0,0.0,0.0,0.0,0.0,0.1,0.0,1.0,0.0,0.0,0.0,0.0,0.0,0.0,0.0,0.0,0.0,0.0,1.0,0.0,0.0,0.0,110,0.0,0.0,0.0,0.0,0.0,0.0,0.0,0.2,0.0,0.0,0.0,0.0,0.0,0.0,0.05,0.0,0.0,0.0,0.15,0.0,0.0,0.0,0.0,0.0,0.0,0.0,0.0,0.0,0.0,0.0,0.0,0.05,0.0,12,0.0,0.0,0.0,0.0,0.0,0.0,0.0,0.0,0.0,0.0,0.0,0.0,0.0,0.0,0.0,0.0,0.0,0.0,0.0,0.0,0.0,0.0,0.0,0.0,0.0,0.0,0.0,0.0,"The WASP platform must be able to render all maps on small, mobile devices, as well as large, fixed terminals.",1,F,1,0.0
37,0.0,0.0,0.0,0.0,0.0,0.0,1.0,0.0,0.0,3,0.0,0.0,0.0,0.0,0.0,0.0,0.0,0.0,0.0,0.0,0.0,0.0,1.0,0.0,0.0,0.0,0.0,0.0,0.0,0.0,0.0,0.0,0.0,0.0,0.0,0.0,0.0,80,0.0,0.0,0.0,0.0,0.0,0.0,0.0,0.06666666666666667,0.0,0.0,0.0,0.0,0.0,0.0,0.06666666666666667,0.0,0.0,0.0,0.2,0.0,0.0,0.0,0.0,0.0,0.0,0.0,0.0,0.0,0.0,0.0,0.0,0.06666666666666667,0.0,12,0.0,0.0,0.0,0.0,0.0,0.0,0.0,0.0,0.0,0.0,0.0,0.0,0.0,0.0,0.0,0.0,0.0,0.0,0.0,0.0,0.0,0.0,0.0,0.0,0.0,0.0,0.0,0.0,The platform must be able to access points of interests and services from a map.,1,F,0,0.0
38,0.0,1.0,0.0,0.0,0.0,0.0,1.0,0.0,0.0,3,0.0,0.0,0.0,0.0,0.0,0.0,0.0,0.0,0.0,0.0,0.043478260869565216,0.0,1.0,0.0,0.0,0.0,0.0,1.0,0.0,0.0,0.0,0.0,0.0,0.0,0.0,0.0,0.0,145,0.0,0.0,0.0,0.0,0.0,0.0,0.0,0.043478260869565216,0.0,0.0,0.0,0.0,0.0,0.0,0.043478260869565216,0.0,0.0,0.0,0.13043478260869565,0.0,0.0,0.0,0.0,0.0,0.0,0.0,0.0,0.0,0.0,0.0,0.0,0.043478260869565216,0.0,13,0.0,0.0,0.0,1.0,0.0,0.0,0.0,1.0,0.0,0.0,0.0,0.0,0.0,0.0,0.0,0.0,0.0,0.0,0.0,0.0,0.0,0.0,0.0,0.0,0.0,0.0,0.0,0.0,"The WASP platform should be able to calculate a route between two or more arbitrarily chosen points, avoiding traffic jams or construction works.",1,F,0,0.0
39,0.0,0.0,0.0,0.0,0.0,0.0,1.0,0.0,0.0,3,0.0,0.0,0.0,0.0,0.0,0.0,0.0,0.0,0.0,0.0,0.1,0.0,1.0,0.0,0.0,0.0,0.0,0.0,1.0,0.0,0.0,0.0,0.0,0.0,0.0,0.0,0.0,135,0.0,0.0,0.0,0.0,0.0,0.0,0.0,0.05,0.0,0.0,0.0,0.0,0.0,0.0,0.05,0.0,0.0,0.0,0.15,0.0,0.0,0.0,0.0,0.0,0.0,0.0,0.0,0.0,0.0,0.0,0.0,0.05,0.0,12,0.0,0.0,0.0,0.0,0.0,1.0,0.0,0.0,0.0,0.0,0.0,0.0,0.0,0.0,0.0,0.0,0.0,0.0,0.0,0.0,0.0,0.0,0.0,0.0,0.0,0.0,0.0,0.0,"The WASP platform should have access to information about traffic jams and construction works, as well as suggested alternative routes.",1,F,0,0.0
40,0.0,1.0,0.0,0.0,0.0,0.0,0.0,0.0,0.0,3,0.0,0.0,0.0,0.0,0.0,0.0,0.0,0.0,0.0,0.0,0.05555555555555555,0.0,1.0,0.0,0.0,0.0,0.0,0.0,0.0,0.0,0.0,0.0,0.0,0.0,0.0,0.0,0.0,116,0.0,0.0,0.0,0.0,0.0,0.0,0.0,0.16666666666666666,0.0,0.0,0.0,0.0,0.0,0.0,0.05555555555555555,0.0,0.0,0.0,0.05555555555555555,0.0,0.0,0.0,0.0,0.0,0.0,1.0,0.0,0.0,0.0,0.0,0.0,0.1111111111111111,0.0,13,0.0,0.0,0.0,1.0,0.0,0.0,0.0,0.0,0.0,0.0,0.0,0.0,0.0,0.0,0.0,0.0,0.0,0.0,0.0,0.0,0.0,0.0,0.0,0.0,0.0,0.0,0.0,0.0,The WASP platform should be possible to determine the location of touristic attractions close to a calculated route.,1,F,0,0.0
41,0.0,0.0,0.0,0.0,0.0,0.0,0.0,0.0,0.0,3,0.0,0.0,0.0,0.0,0.0,0.0,0.0,0.0,0.0,0.0,0.0,0.0,1.0,0.0,0.0,0.0,0.0,0.0,0.0,0.0,0.0,0.0,0.0,0.0,0.0,1.0,0.0,94,0.0,0.0,0.0,0.0,0.0,0.0,0.0,0.058823529411764705,0.0,0.0,0.0,0.0,0.0,0.0,0.058823529411764705,0.0,0.0,0.0,0.23529411764705882,0.0,0.0,0.0,0.0,0.0,0.0,0.0,0.0,0.0,0.0,0.0,0.0,0.058823529411764705,0.0,14,0.0,0.0,0.0,0.0,0.0,0.0,0.0,0.0,0.0,0.0,0.0,0.0,0.0,0.0,0.0,0.0,0.0,0.0,0.0,0.0,0.0,0.0,0.0,0.0,0.0,0.0,0.0,0.0,The WASP platform should be able to determine whether a traffic jam lies on a suggested route.,1,F,0,0.0
